{
    "$schema": "http://json-schema.org/draft-07/schema#",
    "title": "Agentic Workflow Step",
    "description": "Minimal schema for multi-step agent workflows. Step-to-step traceability is achieved via optional parent_step_id linking each step to its direct predecessor.",
    "type": "object",
    "additionalProperties": false,
    "properties": {
      "workflow_id": {
        "type": "string",
        "description": "Unique identifier for the workflow run; all steps in the same run share this value.",
        "minLength": 1
      },
      "step_id": {
        "type": "string",
        "description": "Unique identifier of this step within the workflow.",
        "minLength": 1
      },
      "parent_step_id": {
        "type": "string",
        "description": "Optional: step_id of the direct parent step to form the execution chain/graph.",
        "minLength": 1
      },
      "tool_name": {
        "type": "string",
        "description": "Name of the tool or action invoked at this step.",
        "minLength": 1
      },
      "input_summary": {
        "type": "string",
        "description": "Description of the inputs or prompt for this step.",
        "minLength": 1,
        "maxLength": 4096
      },
      "output_summary": {
        "type": "string",
        "description": "Description of the outputs/results produced by this step.",
        "minLength": 1,
        "maxLength": 4096
      },
      "status": {
        "type": "string",
        "description": "Outcome of the step execution.",
        "enum": ["success", "retry", "timeout", "failed"]
      },
      "duration_ms": {
        "type": "number",
        "description": "End-to-end runtime of the step in milliseconds (non-negative).",
        "minimum": 0
      },
      "error": {
        "type": "object",
        "description": "Error object required when status is 'failed' or 'timeout'.",
        "additionalProperties": false,
        "properties": {
          "message": {
            "type": "string",
            "description": "Human-readable error message explaining the failure/timeout.",
            "minLength": 1,
            "maxLength": 4096
          }
        },
        "required": ["message"]
      }
    },
    "required": [
        "workflow_id",
        "step_id",
        "tool_name",
        "input_summary",
        "output_summary",
        "status",
        "duration_ms"
      ],
      "allOf": [
        {
          "if": {
            "properties": { "status": { "enum": ["failed", "timeout"] } },
            "required": ["status"]
          },
          "then": { "required": ["error"] }
        }
      ]
    }
    