{
    "workflow_id": "wf-002",
    "step_id": "transform-1",
    "parent_step_id": "ingest-1",
    "tool_name": "normalize_schema",
    "input_summary": "raw dataframe 10k rows",
    "output_summary": "operation timed out at 30s",
    "status": "timeout",
    "duration_ms": 30000,
    "error": { "message": "Step exceeded 30s timeout" }
  }
  